Tên sản phẩm,Giá
Laptop HP Gaming Victus 15-FA1139TX 8Y6W3PA,16.790.000đ
Laptop ASUS Gaming VivoBook K3605ZC-RP564W,17.990.000đ
Laptop MSI Modern 14 C12MO-660VN,11.590.000đ
Apple MacBook Air M2 2024 8CPU 8GPU 16GB 256GB I Chính hãng Apple Việt Nam,21.190.000đ
MacBook Air M4 13 inch 2025 10CPU 8GPU 16GB 256GB | Chính hãng Apple Việt Nam,26.490.000đ
Laptop ASUS TUF Gaming A15 FA506NCR-HN047W,19.690.000đ
Laptop HP 250 G9 AG2K7AT,14.990.000đ
Mac mini M4 2024 10CPU 10GPU 16GB 256GB | Chính hãng Apple Việt Nam,14.290.000đ
MacBook Air M4 13 inch 2025 10CPU 10GPU 16GB 512GB | Chính hãng Apple Việt Nam,31.990.000đ
Laptop Lenovo LOQ 15ARP9 83JC007HVN,19.490.000đ
MacBook Pro 14 M4 10CPU 10GPU 16GB 512GB | Chính hãng Apple Việt Nam,39.590.000đ
Laptop Gaming Acer Nitro V ANV15-51-57B2,23.990.000đ
Laptop Acer Gaming Aspire 7 A715-76-53PJ,13.990.000đ
Laptop Gaming Acer Nitro V ANV15-51-58AN,16.990.000đ
MacBook Air M3 13 inch 2024 8CPU 8GPU 16GB - 256GB sạc 30W | Chính hãng Apple Việt Nam,24.690.000đ
Laptop HP Pavilion 15-EG3093TU 8C5L4PA,17.490.000đ
Laptop ASUS Vivobook 15 X1504ZA-NJ517W,13.990.000đ
Laptop ASUS TUF Gaming F15 FX507ZC4-HN095W,20.490.000đ
Laptop Lenovo LOQ 15IAX9 83GS000RVN,24.990.000đ
Laptop ASUS Vivobook 15 X1502VA-BQ886W,16.790.000đ
